# 🚀 MEMORY-OPTIMIZED CHECKER - ANALYSE
**Timestamp:** 3.7.2025, 16:07:43
**Build Started:** 2025-07-03T14:07:43.357Z
**Memory Optimization:** Aktiviert
**Batch Size:** 5 Dateien

════════════════════════════════════════════════════════════════════════════════
## 📊 PROGRESSIVE ANALYSE
════════════════════════════════════════════════════════════════════════════════

📊 Gefundene Dateien: 138
📦 Batch-Verarbeitung mit 5 Dateien pro Batch

✅ Analysiert: main.js (1/138)
✅ Analysiert: preload.js (2/138)
✅ Analysiert: index.html (3/138)
✅ Analysiert: vite.config.js (4/138)
✅ Analysiert: bindungssehnsucht-normal.html (5/138)
✅ Analysiert: das-erste-mal.html (6/138)
✅ Analysiert: der-sichere-hafen.html (7/138)
✅ Analysiert: emotionale-leere.html (8/138)
✅ Analysiert: bindungssehnsucht-normal.md (9/138)
✅ Analysiert: das-erste-mal.md (10/138)
✅ Analysiert: der-sichere-hafen.md (11/138)
✅ Analysiert: emotionale-leere.md (12/138)
✅ Analysiert: erschoepft-vom-stark-sein.md (13/138)
✅ Analysiert: ich-will-einfach-gehalten-werden.md (14/138)
✅ Analysiert: kontrolle-abgeben.md (15/138)
✅ Analysiert: README.md (16/138)
✅ Analysiert: sehnsucht-nach-hingabe.md (17/138)
✅ Analysiert: zu-viel-liebe-zu-wenig-liebe.md (18/138)
✅ Analysiert: erschoepft-vom-stark-sein.html (19/138)
✅ Analysiert: ich-will-einfach-gehalten-werden.html (20/138)
✅ Analysiert: index.html (21/138)
✅ Analysiert: kontrolle-abgeben.html (22/138)
✅ Analysiert: zu-viel-liebe-zu-wenig-liebe.html (23/138)
✅ Analysiert: logCleanup.js (24/138)
✅ Analysiert: seoCheck.js (25/138)
✅ Analysiert: CODING_INSTRUCTIONS.md (26/138)
✅ Analysiert: DEPLOYMENT.md (27/138)
✅ Analysiert: implizite_sexuelle_reichweite_strategie.md (28/138)
✅ Analysiert: instructions_widerspruchs_analyse.md (29/138)
✅ Analysiert: issues.md (30/138)
✅ Analysiert: konkruenz_analyse_2025.md (31/138)
✅ Analysiert: konkurrenz_analyse_2025.md (32/138)
✅ Analysiert: realitaets_analyse_conversion.md (33/138)
✅ Analysiert: reichweite_erhoehung_strategien.md (34/138)
✅ Analysiert: seo_content_strategie.md (35/138)
✅ Analysiert: seo_content_strategie_v2.md (36/138)
✅ Analysiert: seo_implementation_toolkit.md (37/138)
✅ Analysiert: spezifische_blog_posts_ranking.md (38/138)
✅ Analysiert: ARCHIVE_BUILD_LOG_2025-07-02_094143.md (39/138)
✅ Analysiert: ARCHIVE_BUILD_LOG_2025-07-02_094322.md (40/138)
✅ Analysiert: ARCHIVE_BUILD_LOG_2025-07-02_094350.md (41/138)
✅ Analysiert: ARCHIVE_BUILD_LOG_2025-07-02_120742.md (42/138)
✅ Analysiert: ARCHIVE_BUILD_LOG_2025-07-02_121124.md (43/138)
✅ Analysiert: ARCHIVE_BUILD_LOG_2025-07-02_121229.md (44/138)
✅ Analysiert: ARCHIVE_BUILD_LOG_2025-07-02_121350.md (45/138)
✅ Analysiert: ARCHIVE_BUILD_LOG_2025-07-02_123058.md (46/138)
✅ Analysiert: ARCHIVE_BUILD_LOG_2025-07-02_124609.md (47/138)
✅ Analysiert: ARCHIVE_BUILD_LOG_2025-07-02_125624.md (48/138)
✅ Analysiert: ARCHIVE_BUILD_LOG_2025-07-02_125820.md (49/138)
✅ Analysiert: ARCHIVE_BUILD_LOG_2025-07-02_125847.md (50/138)
✅ Analysiert: ARCHIVE_BUILD_LOG_2025-07-02_125918.md (51/138)
✅ Analysiert: ARCHIVE_BUILD_LOG_2025-07-02_130203.md (52/138)
✅ Analysiert: ARCHIVE_BUILD_LOG_2025-07-02_130418.md (53/138)
✅ Analysiert: ARCHIVE_BUILD_LOG_2025-07-02_130859.md (54/138)
✅ Analysiert: ARCHIVE_BUILD_LOG_2025-07-02_131117.md (55/138)
✅ Analysiert: ARCHIVE_BUILD_LOG_2025-07-02_131327.md (56/138)
✅ Analysiert: ARCHIVE_BUILD_LOG_2025-07-02_140216.md (57/138)
✅ Analysiert: ARCHIVE_BUILD_LOG_2025-07-02_143657.md (58/138)
✅ Analysiert: ARCHIVE_BUILD_LOG_2025-07-02_145331.md (59/138)
✅ Analysiert: ARCHIVE_BUILD_LOG_2025-07-02_154700.md (60/138)
✅ Analysiert: ARCHIVE_BUILD_LOG_2025-07-02_155433.md (61/138)
✅ Analysiert: ARCHIVE_BUILD_LOG_2025-07-02_155457.md (62/138)
✅ Analysiert: ARCHIVE_BUILD_LOG_2025-07-02_155650.md (63/138)
✅ Analysiert: ARCHIVE_BUILD_LOG_2025-07-02_155900.md (64/138)
✅ Analysiert: ARCHIVE_BUILD_LOG_2025-07-02_160020.md (65/138)
✅ Analysiert: ARCHIVE_BUILD_LOG_2025-07-02_160359.md (66/138)
✅ Analysiert: ARCHIVE_BUILD_LOG_2025-07-02_160510.md (67/138)
✅ Analysiert: ARCHIVE_BUILD_LOG_2025-07-02_160940.md (68/138)
✅ Analysiert: ARCHIVE_BUILD_LOG_2025-07-02_164228.md (69/138)
✅ Analysiert: ARCHIVE_BUILD_LOG_2025-07-02_171053.md (70/138)
✅ Analysiert: ARCHIVE_BUILD_LOG_2025-07-02_172412.md (71/138)
✅ Analysiert: ARCHIVE_BUILD_LOG_2025-07-02_172549.md (72/138)
✅ Analysiert: ARCHIVE_BUILD_LOG_2025-07-02_172638.md (73/138)
✅ Analysiert: ARCHIVE_BUILD_LOG_2025-07-02_173049.md (74/138)
✅ Analysiert: ARCHIVE_BUILD_LOG_2025-07-02_173416.md (75/138)
✅ Analysiert: ARCHIVE_BUILD_LOG_2025-07-02_174033.md (76/138)
✅ Analysiert: ARCHIVE_BUILD_LOG_2025-07-02_174340.md (77/138)
✅ Analysiert: ARCHIVE_BUILD_LOG_2025-07-02_174927.md (78/138)
✅ Analysiert: ARCHIVE_BUILD_LOG_2025-07-02_175130.md (79/138)
✅ Analysiert: ARCHIVE_BUILD_LOG_2025-07-02_175200.md (80/138)
✅ Analysiert: ARCHIVE_BUILD_LOG_2025-07-02_175321.md (81/138)
✅ Analysiert: ARCHIVE_BUILD_LOG_2025-07-02_175457.md (82/138)
✅ Analysiert: ARCHIVE_BUILD_LOG_2025-07-02_175621.md (83/138)
✅ Analysiert: ARCHIVE_BUILD_LOG_2025-07-02_175717.md (84/138)
✅ Analysiert: ARCHIVE_BUILD_LOG_2025-07-02_180426.md (85/138)
✅ Analysiert: ARCHIVE_BUILD_LOG_2025-07-02_180841.md (86/138)
✅ Analysiert: ARCHIVE_BUILD_LOG_2025-07-02_181031.md (87/138)
✅ Analysiert: ARCHIVE_BUILD_LOG_2025-07-02_183934.md (88/138)
✅ Analysiert: ARCHIVE_BUILD_LOG_2025-07-02_184102.md (89/138)
✅ Analysiert: ARCHIVE_BUILD_LOG_2025-07-02_184913.md (90/138)
✅ Analysiert: ARCHIVE_BUILD_LOG_2025-07-02_185325.md (91/138)
✅ Analysiert: ARCHIVE_BUILD_LOG_2025-07-02_185404.md (92/138)
✅ Analysiert: ARCHIVE_BUILD_LOG_2025-07-02_185811.md (93/138)
✅ Analysiert: ARCHIVE_BUILD_LOG_2025-07-02_185944.md (94/138)
✅ Analysiert: ARCHIVE_BUILD_LOG_2025-07-02_190009.md (95/138)
✅ Analysiert: ARCHIVE_BUILD_LOG_2025-07-02_190310.md (96/138)
✅ Analysiert: ARCHIVE_BUILD_LOG_2025-07-02_192256.md (97/138)
✅ Analysiert: ARCHIVE_BUILD_LOG_2025-07-02_193745.md (98/138)
✅ Analysiert: ARCHIVE_BUILD_LOG_2025-07-02_194238.md (99/138)
✅ Analysiert: ARCHIVE_BUILD_LOG_2025-07-02_195253.md (100/138)
✅ Analysiert: ARCHIVE_BUILD_LOG_2025-07-02_195641.md (101/138)
✅ Analysiert: Codierte_Übergabe-Fantasien__Keyword-Extraktion_.md (102/138)
✅ Analysiert: Hypercodiertes_Keyword-set_Single-frauen_Zuchwil.md (103/138)
✅ Analysiert: konvertierungs_protokoll.md (104/138)
✅ Analysiert: Psychologie_der_Schweizer_Frauensuchen_.md (105/138)
✅ Analysiert: Tiefenanalyse_Frauensuche_Deutschschweiz_.md (106/138)
✅ Analysiert: Tiefenanalyse__Bindungssehnsucht_in_Deutschschweizer_Frauen_.md (107/138)
✅ Analysiert: Tiefenpsychologische_Keyword-Codierung_für_Risikosex-Fantasien_.md (108/138)
✅ Analysiert: Tiefenpsychologische_Keyword-Codierung_für_Singles_.md (109/138)
✅ Analysiert: Tiefenpsychologische_Keyword-Extraktion__Solothurn_Frauen_.md (110/138)
✅ Analysiert: Tiefenpsychologische_SEO-Analyse_für_Vulnerabilität_.md (111/138)
✅ Analysiert: Tiefenpsychologische_SEO-Analyse_für_vulnerable_Frau_.md (112/138)
✅ Analysiert: BUILD_LOG_2025-07-02_072016.md (113/138)
✅ Analysiert: BUILD_LOG_2025-07-02_072326.md (114/138)
✅ Analysiert: BUILD_LOG_2025-07-02_073239.md (115/138)
✅ Analysiert: BUILD_LOG_2025-07-02_080659.md (116/138)
✅ Analysiert: BUILD_LOG_2025-07-02_083538.md (117/138)
✅ Analysiert: EXCEPTION_2025-07-01_211812.md (118/138)
✅ Analysiert: EXCEPTION_2025-07-01_212252.md (119/138)
✅ Analysiert: EXCEPTION_2025-07-01_212403.md (120/138)
✅ Analysiert: EXCEPTION_2025-07-01_213122.md (121/138)
✅ Analysiert: aenderungsprotokoll.md (122/138)
✅ Analysiert: KONKRUENTSPRUEFUNG_EXCEPTION.md (123/138)
✅ Analysiert: TODO_memory_optimization.md (124/138)
✅ Analysiert: ideen_brainstorming.md (125/138)
✅ Analysiert: index.html (126/138)
✅ Analysiert: issues.md (127/138)
✅ Analysiert: kontakt.html (128/138)
✅ Analysiert: README.md (129/138)
✅ Analysiert: robots.txt (130/138)
✅ Analysiert: advanced-content-validator.js (131/138)
✅ Analysiert: build.js (132/138)
✅ Analysiert: direct-checker-test.js (133/138)
✅ Analysiert: log-manager.js (134/138)
✅ Analysiert: simplified-checker.js (135/138)
✅ Analysiert: template.html (136/138)
✅ Analysiert: ueber-mich.html (137/138)
✅ Analysiert: ueber-mich.md (138/138)


════════════════════════════════════════════════════════════════════════════════
## 📋 FINAL REPORT
════════════════════════════════════════════════════════════════════════════════
**Analysierte Dateien:** 138
**Gefundene Issues:** 9
**Durchschnittliche Wortanzahl:** 20189
**Analysezeit:** 5s
**Memory-optimiert:** ✅ Ja

### Top Issues:
- README.md: 2 Issues
- aenderungsprotokoll.md: 2 Issues
- erschoepft-vom-stark-sein.md: 1 Issues
- kontrolle-abgeben.md: 1 Issues
- implizite_sexuelle_reichweite_strategie.md: 1 Issues
- spezifische_blog_posts_ranking.md: 1 Issues
- TODO_memory_optimization.md: 1 Issues

**Build Status:** ✅ MEMORY-OPTIMIZED SUCCESS
**Timestamp:** 3.7.2025, 16:07:47

